{"boss":{"action":"3","axis":["3ff0000000000000","0000000000000000"],"bite_hit":false,"generation":"5","segment":"0","slot":"3","ticks":"0"},"config_hash":"c3d9f44cd488daf8c989e34b789f2e39ae9e68600e66218592d97829c3d866d7","enemies":[{"entity_id":"1","hp":"3ff0000000000000","kind":"0","position":["4097700000000000","4092c00000000000"]},{"entity_id":"2","hp":"3ff0000000000000","kind":"1","position":["4097780000000000","4092c00000000000"]},{"entity_id":"3","hp":"3ff0000000000000","kind":"0","position":["4097800000000000","4092c00000000000"]},{"entity_id":"4","hp":"3ff0000000000000","kind":"1","position":["4097880000000000","4092c00000000000"]},{"entity_id":"5","hp":"3ff0000000000000","kind":"0","position":["4097900000000000","4092c00000000000"]},{"entity_id":"6","hp":"3ff0000000000000","kind":"1","position":["4097980000000000","4092c00000000000"]},{"entity_id":"7","hp":"3ff0000000000000","kind":"0","position":["4097a00000000000","4092c00000000000"]},{"entity_id":"8","hp":"3ff0000000000000","kind":"1","position":["4097a80000000000","4092c00000000000"]},{"entity_id":"9","hp":"3ff0000000000000","kind":"0","position":["4097b00000000000","4092c00000000000"]},{"entity_id":"10","hp":"3ff0000000000000","kind":"1","position":["4097b80000000000","4092c00000000000"]},{"entity_id":"11","hp":"3ff0000000000000","kind":"0","position":["4097c00000000000","4092c00000000000"]},{"entity_id":"12","hp":"3ff0000000000000","kind":"1","position":["4097c80000000000","4092c00000000000"]},{"entity_id":"13","hp":"3ff0000000000000","kind":"0","position":["4097d00000000000","4092c00000000000"]},{"entity_id":"14","hp":"3ff0000000000000","kind":"1","position":["4097d80000000000","4092c00000000000"]},{"entity_id":"15","hp":"3ff0000000000000","kind":"0","position":["4097e00000000000","4092c00000000000"]},{"entity_id":"16","hp":"3ff0000000000000","kind":"1","position":["4097e80000000000","4092c00000000000"]},{"entity_id":"17","hp":"3ff0000000000000","kind":"0","position":["4097f00000000000","4092c00000000000"]},{"entity_id":"18","hp":"3ff0000000000000","kind":"1","position":["4097f80000000000","4092c00000000000"]},{"entity_id":"19","hp":"3ff0000000000000","kind":"0","position":["4098000000000000","4092c00000000000"]},{"entity_id":"20","hp":"3ff0000000000000","kind":"1","position":["4098080000000000","4092c00000000000"]},{"entity_id":"21","hp":"3ff0000000000000","kind":"0","position":["4098100000000000","4092c00000000000"]},{"entity_id":"22","hp":"3ff0000000000000","kind":"1","position":["4098180000000000","4092c00000000000"]},{"entity_id":"23","hp":"3ff0000000000000","kind":"0","position":["4098200000000000","4092c00000000000"]},{"entity_id":"24","hp":"3ff0000000000000","kind":"1","position":["4098280000000000","4092c00000000000"]},{"entity_id":"25","hp":"3ff0000000000000","kind":"0","position":["4098300000000000","4092c00000000000"]},{"entity_id":"26","hp":"3ff0000000000000","kind":"1","position":["4098380000000000","4092c00000000000"]},{"entity_id":"27","hp":"3ff0000000000000","kind":"0","position":["4098400000000000","4092c00000000000"]},{"entity_id":"28","hp":"3ff0000000000000","kind":"1","position":["4098480000000000","4092c00000000000"]},{"entity_id":"29","hp":"3ff0000000000000","kind":"0","position":["4098500000000000","4092c00000000000"]},{"entity_id":"30","hp":"3ff0000000000000","kind":"1","position":["4098580000000000","4092c00000000000"]},{"entity_id":"31","hp":"3ff0000000000000","kind":"0","position":["4098600000000000","4092c00000000000"]},{"entity_id":"32","hp":"3ff0000000000000","kind":"1","position":["4098680000000000","4092c00000000000"]},{"entity_id":"33","hp":"3ff0000000000000","kind":"0","position":["4098700000000000","4092c00000000000"]},{"entity_id":"34","hp":"3ff0000000000000","kind":"1","position":["4098780000000000","4092c00000000000"]},{"entity_id":"35","hp":"3ff0000000000000","kind":"0","position":["4098800000000000","4092c00000000000"]},{"entity_id":"36","hp":"3ff0000000000000","kind":"1","position":["4098880000000000","4092c00000000000"]},{"entity_id":"37","hp":"3ff0000000000000","kind":"0","position":["4098900000000000","4092c00000000000"]},{"entity_id":"38","hp":"3ff0000000000000","kind":"1","position":["4098980000000000","4092c00000000000"]},{"entity_id":"39","hp":"3ff0000000000000","kind":"0","position":["4098a00000000000","4092c00000000000"]},{"entity_id":"40","hp":"3ff0000000000000","kind":"1","position":["4098a80000000000","4092c00000000000"]},{"entity_id":"41","hp":"3ff0000000000000","kind":"0","position":["4098b00000000000","4092c00000000000"]},{"entity_id":"42","hp":"3ff0000000000000","kind":"1","position":["4098b80000000000","4092c00000000000"]},{"entity_id":"43","hp":"3ff0000000000000","kind":"0","position":["4098c00000000000","4092c00000000000"]},{"entity_id":"44","hp":"3ff0000000000000","kind":"1","position":["4098c80000000000","4092c00000000000"]},{"entity_id":"45","hp":"3ff0000000000000","kind":"0","position":["4098d00000000000","4092c00000000000"]},{"entity_id":"46","hp":"3ff0000000000000","kind":"1","position":["4098d80000000000","4092c00000000000"]},{"entity_id":"47","hp":"3ff0000000000000","kind":"0","position":["4098e00000000000","4092c00000000000"]},{"entity_id":"48","hp":"3ff0000000000000","kind":"1","position":["4098e80000000000","4092c00000000000"]},{"entity_id":"49","hp":"3ff0000000000000","kind":"0","position":["4098f00000000000","4092c00000000000"]},{"entity_id":"50","hp":"3ff0000000000000","kind":"1","position":["4098f80000000000","4092c00000000000"]},{"entity_id":"51","hp":"3ff0000000000000","kind":"0","position":["4099000000000000","4092c00000000000"]},{"entity_id":"52","hp":"3ff0000000000000","kind":"1","position":["4099080000000000","4092c00000000000"]},{"entity_id":"53","hp":"3ff0000000000000","kind":"0","position":["4099100000000000","4092c00000000000"]},{"entity_id":"54","hp":"3ff0000000000000","kind":"1","position":["4099180000000000","4092c00000000000"]},{"entity_id":"55","hp":"3ff0000000000000","kind":"0","position":["4099200000000000","4092c00000000000"]},{"entity_id":"56","hp":"3ff0000000000000","kind":"1","position":["4099280000000000","4092c00000000000"]},{"entity_id":"57","hp":"3ff0000000000000","kind":"0","position":["4099300000000000","4092c00000000000"]},{"entity_id":"58","hp":"3ff0000000000000","kind":"1","position":["4099380000000000","4092c00000000000"]},{"entity_id":"59","hp":"3ff0000000000000","kind":"0","position":["4099400000000000","4092c00000000000"]},{"entity_id":"60","hp":"3ff0000000000000","kind":"1","position":["4099480000000000","4092c00000000000"]},{"entity_id":"61","hp":"3ff0000000000000","kind":"0","position":["4099500000000000","4092c00000000000"]},{"entity_id":"62","hp":"3ff0000000000000","kind":"1","position":["4099580000000000","4092c00000000000"]},{"entity_id":"63","hp":"3ff0000000000000","kind":"0","position":["4099600000000000","4092c00000000000"]},{"entity_id":"64","hp":"3ff0000000000000","kind":"1","position":["4099680000000000","4092c00000000000"]},{"entity_id":"65","hp":"3ff0000000000000","kind":"0","position":["4099700000000000","4092c00000000000"]},{"entity_id":"66","hp":"3ff0000000000000","kind":"1","position":["4099780000000000","4092c00000000000"]},{"entity_id":"67","hp":"3ff0000000000000","kind":"0","position":["4099800000000000","4092c00000000000"]},{"entity_id":"68","hp":"3ff0000000000000","kind":"1","position":["4099880000000000","4092c00000000000"]},{"entity_id":"69","hp":"3ff0000000000000","kind":"0","position":["4099900000000000","4092c00000000000"]},{"entity_id":"70","hp":"3ff0000000000000","kind":"1","position":["4099980000000000","4092c00000000000"]},{"entity_id":"71","hp":"3ff0000000000000","kind":"0","position":["4099a00000000000","4092c00000000000"]},{"entity_id":"72","hp":"3ff0000000000000","kind":"1","position":["4099a80000000000","4092c00000000000"]},{"entity_id":"73","hp":"3ff0000000000000","kind":"0","position":["4099b00000000000","4092c00000000000"]},{"entity_id":"74","hp":"3ff0000000000000","kind":"1","position":["4099b80000000000","4092c00000000000"]},{"entity_id":"75","hp":"3ff0000000000000","kind":"0","position":["4099c00000000000","4092c00000000000"]},{"entity_id":"76","hp":"3ff0000000000000","kind":"1","position":["4099c80000000000","4092c00000000000"]},{"entity_id":"77","hp":"3ff0000000000000","kind":"0","position":["4099d00000000000","4092c00000000000"]},{"entity_id":"78","hp":"3ff0000000000000","kind":"1","position":["4099d80000000000","4092c00000000000"]},{"entity_id":"79","hp":"3ff0000000000000","kind":"0","position":["4099e00000000000","4092c00000000000"]},{"entity_id":"80","hp":"3ff0000000000000","kind":"1","position":["4099e80000000000","4092c00000000000"]},{"entity_id":"81","hp":"3ff0000000000000","kind":"0","position":["4099f00000000000","4092c00000000000"]},{"entity_id":"82","hp":"3ff0000000000000","kind":"1","position":["4099f80000000000","4092c00000000000"]},{"entity_id":"83","hp":"3ff0000000000000","kind":"0","position":["409a000000000000","4092c00000000000"]},{"entity_id":"84","hp":"3ff0000000000000","kind":"1","position":["409a080000000000","4092c00000000000"]},{"entity_id":"85","hp":"3ff0000000000000","kind":"0","position":["409a100000000000","4092c00000000000"]},{"entity_id":"86","hp":"3ff0000000000000","kind":"1","position":["409a180000000000","4092c00000000000"]},{"entity_id":"87","hp":"3ff0000000000000","kind":"0","position":["409a200000000000","4092c00000000000"]},{"entity_id":"88","hp":"3ff0000000000000","kind":"1","position":["409a280000000000","4092c00000000000"]},{"entity_id":"89","hp":"3ff0000000000000","kind":"0","position":["409a300000000000","4092c00000000000"]},{"entity_id":"90","hp":"3ff0000000000000","kind":"1","position":["409a380000000000","4092c00000000000"]},{"entity_id":"91","hp":"3ff0000000000000","kind":"0","position":["409a400000000000","4092c00000000000"]},{"entity_id":"92","hp":"3ff0000000000000","kind":"1","position":["409a480000000000","4092c00000000000"]},{"entity_id":"93","hp":"3ff0000000000000","kind":"0","position":["409a500000000000","4092c00000000000"]},{"entity_id